{
  "schema_version": "1.0",
  "source_id": "fin_data_mcp_render_prod",
  "contracts": [
    {
      "capability_id": "fin.crypto.instrument_discovery",
      "status": "UNREGISTERED",
      "required_fields": [],
      "field_types": {},
      "field_schemas": {},
      "max_age_seconds": null,
      "effective_time_field": null,
      "effective_time_format": null,
      "pagination_mode": "UNKNOWN",
      "units": "UNKNOWN",
      "notes": "Production SPOT instrument-list response exceeded the MCP text limit and was truncated; complete discovery schema and freshness semantics remain unavailable."
    },
    {
      "capability_id": "fin.crypto.funding",
      "status": "REGISTERED",
      "required_fields": ["instId", "fundingRate", "ts"],
      "field_types": {"instId": "string", "fundingRate": "string", "ts": "string"},
      "field_schemas": {},
      "max_age_seconds": 3600,
      "effective_time_field": "ts",
      "effective_time_format": "UNIX_MILLISECONDS",
      "pagination_mode": "SINGLE_RESPONSE",
      "units": "fundingRate is the provider-returned decimal rate; preserve native string and funding schedule fields.",
      "notes": "Observed at production endpoint for BTC-USDT-SWAP. The one-hour qualification freshness bound is repository policy, not a provider SLA."
    },
    {
      "capability_id": "fin.crypto.open_interest",
      "status": "REGISTERED",
      "required_fields": ["instId", "oi", "oiCcy", "oiUsd", "ts"],
      "field_types": {"instId": "string", "oi": "string", "oiCcy": "string", "oiUsd": "string", "ts": "string"},
      "field_schemas": {},
      "max_age_seconds": 600,
      "effective_time_field": "ts",
      "effective_time_format": "UNIX_MILLISECONDS",
      "pagination_mode": "SINGLE_RESPONSE",
      "units": "Preserve provider-native oi, oiCcy, and oiUsd strings; do not infer interchangeable units.",
      "notes": "Observed at production endpoint for BTC-USDT-SWAP. Ten-minute qualification freshness bound is repository policy, not a provider SLA."
    },
    {
      "capability_id": "fin.crypto.long_short_ratio",
      "status": "REGISTERED",
      "required_fields": ["0", "1"],
      "field_types": {"0": "string", "1": "string"},
      "field_schemas": {},
      "max_age_seconds": 600,
      "effective_time_field": "0",
      "effective_time_format": "UNIX_MILLISECONDS",
      "pagination_mode": "SINGLE_RESPONSE",
      "units": "Each provider row is [Unix-millisecond timestamp, longShortRatio string].",
      "notes": "Observed at production endpoint for BTC with 5m period (576 rows). Ten-minute qualification freshness bound is repository policy, not a provider SLA."
    },
    {
      "capability_id": "fin.crypto.mark_price",
      "status": "REGISTERED",
      "required_fields": ["instId", "markPx", "ts"],
      "field_types": {"instId": "string", "markPx": "string", "ts": "string"},
      "field_schemas": {},
      "max_age_seconds": 600,
      "effective_time_field": "ts",
      "effective_time_format": "UNIX_MILLISECONDS",
      "pagination_mode": "SINGLE_RESPONSE",
      "units": "Preserve markPx as a provider-native price string.",
      "notes": "Observed at production endpoint for BTC-USDT-SWAP. Ten-minute qualification freshness bound is repository policy, not a provider SLA."
    },
    {
      "capability_id": "fin.crypto.ticker",
      "status": "REGISTERED",
      "required_fields": ["instId", "last", "bidPx", "askPx", "ts"],
      "field_types": {"instId": "string", "last": "string", "bidPx": "string", "askPx": "string", "ts": "string"},
      "field_schemas": {},
      "max_age_seconds": 600,
      "effective_time_field": "ts",
      "effective_time_format": "UNIX_MILLISECONDS",
      "pagination_mode": "SINGLE_RESPONSE",
      "units": "Prices and sizes remain provider-native strings; spot and swap instruments are distinguished by instId/instType.",
      "notes": "Observed for BTC-USDT SPOT and BTC-USDT-SWAP. Ten-minute qualification freshness bound is repository policy, not a provider SLA."
    },
    {
      "capability_id": "fin.crypto.orderbook",
      "status": "REGISTERED",
      "required_fields": ["asks", "bids", "ts"],
      "field_types": {"asks": "array", "bids": "array", "ts": "string"},
      "field_schemas": {
        "asks": {"type": "array", "minItems": 1, "maxItems": 5, "items": {"type": "array", "minItems": 4, "maxItems": 4, "items": {"type": "string"}}},
        "bids": {"type": "array", "minItems": 1, "maxItems": 5, "items": {"type": "array", "minItems": 4, "maxItems": 4, "items": {"type": "string"}}}
      },
      "max_age_seconds": 600,
      "effective_time_field": "ts",
      "effective_time_format": "UNIX_MILLISECONDS",
      "pagination_mode": "SINGLE_RESPONSE",
      "units": "Each level is [price, size, liquidation flag, order count] as provider-native strings.",
      "notes": "Observed for BTC-USDT-SWAP at depth 5. Ten-minute qualification freshness bound is repository policy, not a provider SLA."
    },
    {
      "capability_id": "fin.crypto.recent_trades",
      "status": "REGISTERED",
      "required_fields": ["instId", "px", "side", "sz", "ts"],
      "field_types": {"instId": "string", "px": "string", "side": "string", "sz": "string", "ts": "string"},
      "field_schemas": {},
      "max_age_seconds": 600,
      "effective_time_field": "ts",
      "effective_time_format": "UNIX_MILLISECONDS",
      "pagination_mode": "SINGLE_RESPONSE",
      "units": "Preserve provider-native price, size, side, and trade identifiers.",
      "notes": "Observed 10 public BTC-USDT-SWAP prints. Ten-minute qualification freshness bound is repository policy, not a provider SLA."
    },
    {
      "capability_id": "fin.crypto.candles",
      "status": "REGISTERED",
      "required_fields": ["0", "1", "2", "3", "4", "5", "6", "7", "8"],
      "field_types": {"0": "string", "1": "string", "2": "string", "3": "string", "4": "string", "5": "string", "6": "string", "7": "string", "8": "string"},
      "field_schemas": {},
      "max_age_seconds": 7200,
      "effective_time_field": "0",
      "effective_time_format": "UNIX_MILLISECONDS",
      "pagination_mode": "SINGLE_RESPONSE",
      "units": "Each provider candle row is [ts, open, high, low, close, volume, volumeCurrency, volumeQuote, confirmation] strings.",
      "notes": "Observed for BTC-USDT-SWAP at 1H with limit 1. Two-hour qualification freshness bound allows two bar intervals; repository policy, not a provider SLA."
    },
    {
      "capability_id": "fin.crypto.index_candles",
      "status": "REGISTERED",
      "required_fields": ["0", "1", "2", "3", "4", "5"],
      "field_types": {"0": "string", "1": "string", "2": "string", "3": "string", "4": "string", "5": "string"},
      "field_schemas": {},
      "max_age_seconds": 7200,
      "effective_time_field": "0",
      "effective_time_format": "UNIX_MILLISECONDS",
      "pagination_mode": "SINGLE_RESPONSE",
      "units": "Each provider index candle row is [ts, open, high, low, close, volume] strings.",
      "notes": "Observed for BTC-USD index at 1H with limit 1. This is historical candle data, not a live index ticker. Two-hour qualification freshness bound is repository policy, not a provider SLA."
    }
  ],
  "notes": [
    "Nine read capability response contracts are bound to captured production responses. Instrument discovery remains unregistered because its response was truncated.",
    "Freshness bounds are explicit repository qualification policies chosen for the observed data cadences; they are not provider guarantees or research admission decisions.",
    "A qualified source capability remains disabled for admission until a separate, versioned dependency decision occurs."
  ]
}
